{
  "$schema": "https://json-schema.org/draft/2020-12/schema",
  "$id": "urn:kim-silver-youtube:schema:common-record:v1",
  "title": "Common Record v1",
  "description": "Domain-neutral file record envelope.",
  "type": "object",
  "additionalProperties": false,
  "required": [
    "id",
    "record_type",
    "schema_version",
    "created_at",
    "updated_at",
    "payload",
    "content_hash"
  ],
  "properties": {
    "id": {
      "type": "string",
      "format": "uuid",
      "pattern": "^[0-9a-f]{8}-[0-9a-f]{4}-4[0-9a-f]{3}-[89ab][0-9a-f]{3}-[0-9a-f]{12}$"
    },
    "record_type": {
      "type": "string",
      "pattern": "^[a-z][a-z0-9]*(?:_[a-z0-9]+)*$"
    },
    "schema_version": {
      "const": 1
    },
    "created_at": {
      "type": "string",
      "pattern": "^[0-9]{4}-[0-9]{2}-[0-9]{2}T[0-9]{2}:[0-9]{2}:[0-9]{2}Z$"
    },
    "updated_at": {
      "type": "string",
      "pattern": "^[0-9]{4}-[0-9]{2}-[0-9]{2}T[0-9]{2}:[0-9]{2}:[0-9]{2}Z$"
    },
    "payload": {
      "type": "object"
    },
    "content_hash": {
      "type": "string",
      "pattern": "^sha256:[0-9a-f]{64}$"
    }
  }
}
