{
  "content_hash": "sha256:cd8863dced0b59c536ce614211052c20d51115e269498c0dedd2a880237eff55",
  "created_at": "2026-07-22T20:07:19Z",
  "id": "e97d94b1-7ba5-4cdc-bcdf-e8b0f92f394a",
  "payload": {
    "conflict_ids": [],
    "last_actor": "agent:stage06",
    "last_approval_kind": "standing_policy",
    "last_decision_id": null,
    "last_event_id": "739d40d4-d566-4144-80b3-88a9dbe41d50",
    "last_reason": "Stage 05 검증 상태를 보존한 최소 수명주기 등록",
    "last_source_ids": [],
    "revision": 1,
    "state": "current",
    "superseded_by": null,
    "target_id": "247158de-00c8-443b-a220-06cd4b40db13",
    "target_type": "source"
  },
  "record_type": "lifecycle_state",
  "schema_version": 1,
  "updated_at": "2026-07-22T20:07:19Z"
}
