{
  "content_hash": "sha256:d71b5cb8e93fc0ddf1b1ce6db6c06133177381318232be9801b43e92be07f5ef",
  "created_at": "2026-07-22T20:07:20Z",
  "id": "204bdd94-0a0a-437e-9c15-97479c1318d0",
  "payload": {
    "conflict_ids": [],
    "last_actor": "agent:stage06",
    "last_approval_kind": "standing_policy",
    "last_decision_id": null,
    "last_event_id": "1ddaa2ab-a11a-44a1-8694-1dfc7254a90f",
    "last_reason": "drift? ?? source? ?? ?? source? ??",
    "last_source_ids": [],
    "revision": 3,
    "state": "superseded",
    "superseded_by": "f5d5ecd6-43bd-4dd7-8f3e-2e769be44493",
    "target_id": "51a05a01-1c72-4f66-91f6-c763d7f3050a",
    "target_type": "source"
  },
  "record_type": "lifecycle_state",
  "schema_version": 1,
  "updated_at": "2026-07-22T20:07:57Z"
}
