{
  "content_hash": "sha256:8d53acbed63c0194c564fc697534239e0561bc7217d1171b00847f988e1c8286",
  "created_at": "2026-07-22T19:41:24Z",
  "id": "2b9e5b42-9a41-4bd8-999f-1b4a5d54050b",
  "payload": {
    "evidence_role": "primary",
    "locator": "failures/runtime-discovery-system-python.md",
    "observed_at": "2026-07-22T19:41:24Z",
    "source_kind": "local_document",
    "verification_status": "verified",
    "version_or_hash": "sha256:eb989218917630b1f955038836b22521a00198d1cf1ae03c25c43421196b9b2b"
  },
  "record_type": "source",
  "schema_version": 1,
  "updated_at": "2026-07-22T19:41:24Z"
}
