{
  "content_hash": "sha256:3301d2a57eac24d94774a0125e82e21930ea41c4c351f6d25bcc79f6c9f20897",
  "created_at": "2026-07-22T21:00:12Z",
  "id": "eb629d42-b9ad-4e7f-af05-57c80d8440cb",
  "payload": {
    "classification": "constraint",
    "scope": "프로젝트 정보·문서 책임",
    "source_ids": [
      "ce77cc84-68db-47bb-8203-daa0cefdf19f"
    ],
    "statement": "활성 정보마다 단일 소유자를 둔다.",
    "verification_status": "verified",
    "verified_by": "agent:stage08-standing-policy"
  },
  "record_type": "knowledge",
  "schema_version": 1,
  "updated_at": "2026-07-22T21:00:12Z"
}
