{
  "content_hash": "sha256:cab778565426772ccbe17f2e36cd1c0c2b9cc079df310e4ea95985ea3b8e3bb6",
  "created_at": "2026-07-22T19:41:25Z",
  "id": "41242d43-1696-4fff-875d-6d532389a2ed",
  "payload": {
    "canonical_doc_ref": "failures/trailing-whitespace-regex.md",
    "conditions": [
      "PowerShell 기반 Markdown 후행 공백 검사"
    ],
    "confirmed_cause": "탭을 검사하려던 표현이 실제 탭 문자가 아니라 문자 `t`로 해석되어, `t`로 끝나는 정상 영문까지 후행 공백으로 오탐했다.",
    "document_hash": "sha256:82432ec08eea3a0367616499ca81371d588b6415275e3f2dbdc4351ccf7c0348",
    "prevention": [
      "PowerShell과 정규식 엔진 사이의 이스케이프 해석을 추정하지 말고 실제 대상 문자열로 검증한다.",
      "후행 공백 검사는 `[ \\x09]+$`처럼 공백과 탭을 명시한다.",
      "대량 검출 시 문서를 일괄 수정하기 전에 대표 오탐 한 건의 문자 코드를 확인한다."
    ],
    "projected_at": "2026-07-22T19:41:25Z",
    "projected_by": "agent:stage05d-gate",
    "projection_status": "resolved",
    "resolution": [
      "후행 공백 정규식에서 탭을 `\\x09`로 명시했다."
    ],
    "source_id": "4d8cc1c1-cba8-4acb-ba65-7adf0042773c",
    "symptom": "정상 문장 끝이 후행 공백으로 대량 검출되어 Stage 00 문서 검증이 실패했다.",
    "title": "후행 공백 정규식의 탭 오해석",
    "verification": [
      "수정한 검사로 같은 활성 문서 집합을 다시 검사해 후행 공백 0건을 확인했다.",
      "`git diff --check`도 함께 통과했다."
    ]
  },
  "record_type": "failure_knowledge",
  "schema_version": 1,
  "updated_at": "2026-07-22T19:41:25Z"
}
