{
  "content_hash": "sha256:05cde8b252254dd672905450cc7f6c1d5f07b423d2fc3aecc4ab2940b7ed7658",
  "created_at": "2026-07-22T19:41:25Z",
  "id": "dfbd7abb-cad2-468e-80d8-2eeeb4b52764",
  "payload": {
    "evidence_role": "primary",
    "locator": "failures/work-event-time-regression.md",
    "observed_at": "2026-07-22T19:41:25Z",
    "source_kind": "local_document",
    "verification_status": "verified",
    "version_or_hash": "sha256:7e46631ad98cd55943f9b5e548257d5b40a074e6fd86b8961b07f8f2e958c751"
  },
  "record_type": "source",
  "schema_version": 1,
  "updated_at": "2026-07-22T19:41:25Z"
}
