{
  "content_hash": "sha256:787033a6558e357fec26eaf7dfeaa4572460f95a82084d08cc6f4712bb27897b",
  "created_at": "2026-07-23T04:18:37Z",
  "id": "e97136dc-a735-4f76-a41a-ba7951640319",
  "payload": {
    "conflict_ids": [],
    "last_actor": "agent:codex-session",
    "last_approval_kind": "user",
    "last_decision_id": null,
    "last_event_id": "b6cd74e2-0f75-49d6-a419-50585702cd5a",
    "last_reason": "User-approved UTF-8 recurrence record reconciliation",
    "last_source_ids": [
      "de40d1b2-8d2a-4f01-8792-c6a92b1aa008"
    ],
    "revision": 1,
    "state": "current",
    "superseded_by": null,
    "target_id": "e7efee0c-560e-4710-b0a2-f89ac457dac0",
    "target_type": "failure_knowledge"
  },
  "record_type": "lifecycle_state",
  "schema_version": 1,
  "updated_at": "2026-07-23T04:18:37Z"
}
