{
  "content_hash": "sha256:6b6d0d49f01476e181fb667be16496fd3e506a2c1e12c10c11b29414679c89b3",
  "created_at": "2026-07-22T20:07:28Z",
  "id": "5faf8779-d42f-4ffc-aee5-76c5f90dc3f5",
  "payload": {
    "conflict_ids": [],
    "last_actor": "agent:stage06",
    "last_approval_kind": "standing_policy",
    "last_decision_id": null,
    "last_event_id": "0acdf812-2654-404a-9fd4-28a3d0ffba58",
    "last_reason": "Stage 06 UTF-8 pipe ?? ??? ??? ?? ?? ??",
    "last_source_ids": [],
    "revision": 3,
    "state": "superseded",
    "superseded_by": "26b60808-1f0d-4536-b596-7d634db506d6",
    "target_id": "9091355d-0aef-42ec-b356-ad9f1f5ff87d",
    "target_type": "failure_knowledge"
  },
  "record_type": "lifecycle_state",
  "schema_version": 1,
  "updated_at": "2026-07-22T20:14:16Z"
}
