{
  "content_hash": "sha256:cc0ed5a3cd4e7fd79337637eb89426e79fb081f59d120dda0c0aa7102a467bf2",
  "created_at": "2026-07-22T20:07:18Z",
  "id": "7a918862-0e87-4752-b1b6-6e3c7b55b3cf",
  "payload": {
    "conflict_ids": [],
    "last_actor": "agent:stage06",
    "last_approval_kind": "standing_policy",
    "last_decision_id": null,
    "last_event_id": "9e72c7a1-51a4-4c39-b7bb-8b0a254aae65",
    "last_reason": "Stage 05 검증 상태를 보존한 최소 수명주기 등록",
    "last_source_ids": [],
    "revision": 1,
    "state": "current",
    "superseded_by": null,
    "target_id": "04574082-035f-4910-bf5e-edf3b72c08c2",
    "target_type": "source"
  },
  "record_type": "lifecycle_state",
  "schema_version": 1,
  "updated_at": "2026-07-22T20:07:18Z"
}
