{
  "content_hash": "sha256:7701868ddce0da0b21777d42bcba25ef464ab546c1bce6ee1f212e7f36f300ac",
  "created_at": "2026-07-22T20:07:57Z",
  "id": "6001c255-fe63-46aa-8b13-cd8de4df8031",
  "payload": {
    "conflict_ids": [],
    "last_actor": "agent:stage07",
    "last_approval_kind": "standing_policy",
    "last_decision_id": null,
    "last_event_id": "e467fdc8-d3af-4beb-a14e-a90b857139c6",
    "last_reason": "개정 source를 참조하는 기존 지식 대체",
    "last_source_ids": [],
    "revision": 3,
    "state": "superseded",
    "superseded_by": "92bba166-73ca-4909-a82c-0ff8fe7d1f2c",
    "target_id": "bdbffc75-b328-4b22-a390-ea5ac7316653",
    "target_type": "knowledge"
  },
  "record_type": "lifecycle_state",
  "schema_version": 1,
  "updated_at": "2026-07-22T20:36:09Z"
}
