{
  "content_hash": "sha256:ac38826c49c1f1a1d25abd55f04d04eda1b95a59969aa94af96aa060464065d5",
  "created_at": "2026-07-22T20:07:19Z",
  "id": "e2228871-5297-4be8-9570-b984f81d208b",
  "payload": {
    "conflict_ids": [],
    "last_actor": "agent:stage06",
    "last_approval_kind": "standing_policy",
    "last_decision_id": null,
    "last_event_id": "33960dc5-fb43-44a6-8916-d64692bdae10",
    "last_reason": "Stage 06 ?? ??? ??? ?? ?? ??",
    "last_source_ids": [],
    "revision": 3,
    "state": "superseded",
    "superseded_by": "aff1d799-7e79-45f2-9f13-d2b750e8e464",
    "target_id": "33810c76-fc27-4d14-9d2c-e6fe5d7cc22d",
    "target_type": "source"
  },
  "record_type": "lifecycle_state",
  "schema_version": 1,
  "updated_at": "2026-07-22T20:07:58Z"
}
