{
  "content_hash": "sha256:6dff6f803f5d8b39e6508c23ca3b25803fc882c0b88d866f803caa9906985673",
  "created_at": "2026-07-22T19:41:24Z",
  "id": "c4aff604-349f-41d6-996d-4113dcc4653d",
  "payload": {
    "evidence_role": "primary",
    "locator": "failures/record-id-address-ambiguity.md",
    "observed_at": "2026-07-22T19:41:24Z",
    "source_kind": "local_document",
    "verification_status": "verified",
    "version_or_hash": "sha256:5a853205e437f3eeaf48c3d69c05167a2e0030bd3bc105432e8333ceab2df395"
  },
  "record_type": "source",
  "schema_version": 1,
  "updated_at": "2026-07-22T19:41:24Z"
}
