{
  "content_hash": "sha256:0fb76cc7def360a547435adca9475b59739a747eceb316963a77fb91a3f24834",
  "created_at": "2026-07-22T20:07:27Z",
  "id": "2a647109-efb2-4a13-9a1c-5b60cf227861",
  "payload": {
    "conflict_ids": [],
    "last_actor": "agent:stage06",
    "last_approval_kind": "standing_policy",
    "last_decision_id": null,
    "last_event_id": "12a4cb24-a0df-421d-a686-a56aa6efc48c",
    "last_reason": "Stage 05 검증 상태를 보존한 최소 수명주기 등록",
    "last_source_ids": [],
    "revision": 1,
    "state": "current",
    "superseded_by": null,
    "target_id": "7f91a5b9-8878-4d98-ac05-0caaacfc3090",
    "target_type": "failure_knowledge"
  },
  "record_type": "lifecycle_state",
  "schema_version": 1,
  "updated_at": "2026-07-22T20:07:27Z"
}
