{
  "content_hash": "sha256:d320f487b70da4b1fa4a41fa3155fb11fdff8948f81b5aa3034799aff1a097ae",
  "created_at": "2026-07-22T19:41:24Z",
  "id": "7f91a5b9-8878-4d98-ac05-0caaacfc3090",
  "payload": {
    "canonical_doc_ref": "failures/record-id-address-ambiguity.md",
    "conditions": [
      "파일 기록 ID, 저장 경로, 중복 거부, 전역 열거 방지"
    ],
    "confirmed_cause": "안정적인 기록 ID와 파일 저장 주소를 독립적으로 설계하면서 중복 검사의 책임을 별도 인덱스나 전체 탐색에 암묵적으로 넘겼다. Stage 02에는 그런 인덱스가 없고 보호 경계를 넘는 전역 탐색도 허용되지 않는다.",
    "document_hash": "sha256:5a853205e437f3eeaf48c3d69c05167a2e0030bd3bc105432e8333ceab2df395",
    "prevention": [
      "파일 기반 고유성을 요구하면서 중앙 인덱스가 없다면 ID와 저장 주소의 결정적 대응을 먼저 검토한다.",
      "경로 자유도를 높여 중복 검사를 전역 탐색에 의존하게 만들지 않는다.",
      "유형별 디렉터리가 필요해지면 같은 ID의 권위 범위와 충돌 검사를 먼저 다시 결정한다."
    ],
    "projected_at": "2026-07-22T19:41:24Z",
    "projected_by": "agent:stage05d-gate",
    "projection_status": "resolved",
    "resolution": [
      "UUIDv4 ID 하나가 단일 `data/records/<id>.json` 경로에 대응하도록 계약했다."
    ],
    "source_id": "c4aff604-349f-41d6-996d-4113dcc4653d",
    "symptom": "첫 구현은 안전한 프로젝트 상대 경로라면 임의 파일명에 기록을 저장할 수 있었다. 테스트는 통과했지만 같은 ID를 서로 다른 파일명이나 디렉터리에 쓰면 전역 파일 열거 없이 중복을 막을 수 없었다.",
    "title": "기록 ID와 저장 주소의 분리로 생기는 중복",
    "verification": [
      "다른 저장 루트와 ID가 다른 파일명을 모두 거부한다.",
      "같은 ID를 새로 쓰면 같은 경로의 기본 덮어쓰기 거부가 중복을 차단한다.",
      "별도 인덱스, 디렉터리 전역 열거, 보호 경로 접근 없이 회귀 테스트를 통과했다."
    ]
  },
  "record_type": "failure_knowledge",
  "schema_version": 1,
  "updated_at": "2026-07-22T19:41:24Z"
}
