{
  "content_hash": "sha256:a189042a41e8a1f17fc6df87c7e41ade38841a291f21dbc96b1e43db82fabd85",
  "created_at": "2026-07-22T20:07:29Z",
  "id": "01dfa83c-4479-460b-a699-63e5e5a0bb3b",
  "payload": {
    "conflict_ids": [],
    "last_actor": "agent:stage06",
    "last_approval_kind": "standing_policy",
    "last_decision_id": null,
    "last_event_id": "9170e671-d9fb-4442-8bd1-4c52001275f4",
    "last_reason": "Stage 05 검증 상태를 보존한 최소 수명주기 등록",
    "last_source_ids": [],
    "revision": 1,
    "state": "current",
    "superseded_by": null,
    "target_id": "c7630ea0-8b06-4a94-b151-0ebab6e09b8f",
    "target_type": "failure_knowledge"
  },
  "record_type": "lifecycle_state",
  "schema_version": 1,
  "updated_at": "2026-07-22T20:07:29Z"
}
