{
  "content_hash": "sha256:4533820fa597a429c82eb1b4ab95418cb6bd9f9d380a30091b350ff4cd240360",
  "created_at": "2026-07-23T00:00:00Z",
  "id": "123e4567-e89b-42d3-a456-426614174000",
  "payload": {
    "message": "중립 예제"
  },
  "record_type": "example",
  "schema_version": 1,
  "updated_at": "2026-07-23T00:00:00Z"
}
