{
  "content_hash": "sha256:2fd9ef28d9266f15b953e6945e401eafc74ab52ed67c1ba9f38a76adf3f00dcd",
  "created_at": "2026-07-22T21:28:57Z",
  "id": "ab66a142-b2de-4a08-8fe8-f9339e1a67d6",
  "payload": {
    "conflict_ids": [],
    "last_actor": "agent:codex",
    "last_approval_kind": "standing_policy",
    "last_decision_id": null,
    "last_event_id": "0529d36d-2e21-412b-93a4-1ffc67c21651",
    "last_reason": "Stage 10 계약 보정으로 검증된 current replacement 적용",
    "last_source_ids": [],
    "revision": 2,
    "state": "superseded",
    "superseded_by": "9cd29c01-06e9-42ab-bd05-87f4d83f6fab",
    "target_id": "b3c8bfe5-642b-412c-a0b7-07584643e389",
    "target_type": "knowledge"
  },
  "record_type": "lifecycle_state",
  "schema_version": 1,
  "updated_at": "2026-07-23T06:34:14Z"
}
