{
  "content_hash": "sha256:8993d0984f4c90a5e0d7ab6f1ec896587ee0bcb2c48f81afd5e0b07ee148928f",
  "created_at": "2026-07-22T19:41:24Z",
  "id": "20414622-6b98-4f2e-aebb-77c263f65b43",
  "payload": {
    "evidence_role": "primary",
    "locator": "failures/premature-future-stage-implementation.md",
    "observed_at": "2026-07-22T19:41:24Z",
    "source_kind": "local_document",
    "verification_status": "verified",
    "version_or_hash": "sha256:aa853cb6724ef6f95025832e5f75992c08806e5f38d9d79cd539ba877fd337da"
  },
  "record_type": "source",
  "schema_version": 1,
  "updated_at": "2026-07-22T19:41:24Z"
}
