{
  "content_hash": "sha256:2a48ac42131d0119ea01dfc70532f2f89e11904db5a01fb6e867843d901607f5",
  "created_at": "2026-07-22T20:07:26Z",
  "id": "8d034120-7e52-4eb6-a5cc-d224c3286c8e",
  "payload": {
    "conflict_ids": [],
    "last_actor": "agent:stage06",
    "last_approval_kind": "standing_policy",
    "last_decision_id": null,
    "last_event_id": "58a12776-1f17-464e-8da0-76f16b04ac4f",
    "last_reason": "Stage 05 검증 상태를 보존한 최소 수명주기 등록",
    "last_source_ids": [],
    "revision": 1,
    "state": "current",
    "superseded_by": null,
    "target_id": "48b497b8-8f93-4f45-94c3-4183e51ecbd6",
    "target_type": "failure_knowledge"
  },
  "record_type": "lifecycle_state",
  "schema_version": 1,
  "updated_at": "2026-07-22T20:07:26Z"
}
